text,location,interest
iuofficial ranks top 5 multiple countries globally 2023 popular hallyu stars ranking surveyed ministry culture sports tourism appears lists us england taiwan malaysia south africa china,,Sports
theres lot going mind lots want say sport love sea games still sudirman cup around corner malaysia masters soon forgetting start olympic qualification athletes need us ever,,Sports
malaysia sportnet methodology celebrated training sessions 39 coaches country methodology uses sports physical activities medium children empower equal participation social inclusion,,Sports
fomo fear losing journey started cramped boat amp family fled vietnam 70s landed hong kong father mother amp 3 siblings went malaysia escaping war torn vietnam goal odogwutales,,Sports
south korea ministry culture sports tourism ranked bigbang one popular male groups multiple countries 2023 list 2 malaysia 2 vietnam 2 australia 2 canada 2 germany 3 uk,,Sports
would like commend initiative youth sports minister yb hannah yeoh ministry kbs ensure stadiums malaysia good football fields 17,,Sports
guys cant believe face jd sports store singapore malaysia thailand literally made wan na cry,,Sports
fih odisha hockey mens world cup 2023 latest update crossover match sunday 22 jan 2023 malaysia vs spain 700 pm malaysia time fih world sports pic,,Sports
malaysia mental gymnastics olympic sport,,Sports
volleyball coach recently taped slapping two players temporarily suspended involvement sport malaysia volleyball association said investigative body examine incident set immediately,,Sports
aff live national tv rtmmalaysia showed qatar world cup support malaysian sports imminent amp prerequisite take note next month msian hockey team playing world cup hope live fahmifadzil hannahyeoh rtmmalaysia,,Sports
dearest friend hannahyeoh best kbs give youth sports malaysia,,Sports
alexirwani tansuyegen coughing excuse sepak takraw originally malaysia tanah melayu 15th century malay sultanate malacca malay annalssejarah melayu 16th century spread across indonesia dont claim sport origin,,Sports
first jd sports store east malaysia officially opened vivacity megamall kuching sarawak,Sarawak,Sports
fan club currently giving importance sports among youngsters fourth time malaysia ajith fan club hosting sports event public amp ajithkumar sir fans nationwide thunivufutsal thunivu nogutsnoglory ajithkumar,,Sports
thank pschan88 yee see amp yen wei national mixed doubles players chan peng soon peck yen wei cheah yee see decided chart destiny sport opting become independent players read full badmintonmalaysia,,Sports
coming malaysia day victorxlzj collection coming 7 items including racquet bags tshirt wristbands sports towels socks caps water bottles,,Sports
im proud lzj fan im malaysian sports fan first foremost long athlete team representing malaysia support himher 100,,Sports
malaysia needs future talents sport also needs sport journalists like mondaymotivation,,Sports
special episode run bts 2022 mentioned sepak takraw common sport malaysia acc source sport introduced 1965 southeast asian game kuala lumpur medal event also considered malaysias national sport runbtscomeback,Kuala Lumpur,Sports
among others malaysia sports year mens indoor asia cup badminton asia team championships qualified 2023 afc asian cup qualified 2023 mens fih hockey world cup year malayan tiger,,Sports
bonnie bunyau gustin delivered malaysias fourth b2022 gold medal smashing games record three consecutive times also became first nonnigerian win para powerlifting gold medal commonwealth games since sport included 2002,,Sports
sports undoubtedly best enjoyed pinch camaraderie presence radiant sunshine also romance soaking solitude couch wee hours morning emotions cloaked morning dew congrats bamalaysia,,Sports
respect start small every comment every word whether sidelines online always give best despite limitations competing small contingent battling powerhouses sport malaysia demimalaysia kalau bukan kita siapa lagi,,Sports
uganda malaysia trkiye colombia together refugees working support refugee children though sports development s4d fundaciofcb withrefugees eacnur,,Sports
spoke sport minister malaysia swimming aware lack state participation coming sukma since months ago already looking better solution lets work support future malaysia diving,,Sports
bonodori 46th annual bon odori celebrations colourful celebration japanese culture malaysia thousands descended shah alam sports complex years bon odori festival 2 year hiatus due covid19 festival returned full glory,,Sports
pizza delivery rider student sold sports equipment friends amp lecturers pay university fees today owns malaysias 1 homegrown sports store tn haji ali hassan mohd hassan founder alikhsan sports story,,Sports
utk bl malaysia proud malaysia improved lot sport presentation kudis congrats new super 1000 council bamalaysia,,Sports
together withunhcr refugees going support displacement projects uganda malaysia turkey colombia sports development info withrefugees s4d fcbarcelona,,Sports
although niche sport soh still best compete amp win malaysia also founded malaysia towerrunning association soh great example malaysian citizen loves country wish sponsor please dm mastowerrunner,,Sports
worst sports minister malaysia ever achievement quality shame,,Sports
thomas cup quarterfinal win malaysia make medal stages huge thing indian sport indian get medal indian badminton enough depth players win team event always great outlier players,,Sports
seagames2021 womens volleyball philippines defeats malaysia 3 straight sets 2514 2520 2515,,Sports
time come show philippines vs malaysia 1200 seagames31 catch cignal one sports one sports cignal play smart gigaplay,,Sports
back kuala lumpur home sweet home 6 days vietnam hanoi great malaysia diving team time wish sports team big good luck seagames2022 demimalaysia,Kuala Lumpur,Sports
6 wickets 6 balls ever seen five wickets malaysia xis virandeep singh plus runout final push sports delhi nepal pro club championship,,Sports
allengland2022 order play qf 600pm myt astro supersport 4 astro arena rtm sports tv okey myfreeview demimalaysia badmintonmalaysia,,Sports
allengland2022 order play day 2 700pm myt astro supersport 4 astro arena rtm sports tv okey myfreeview demimalaysia badmintonmalaysia,,Sports
allengland2022 order play day 1 500pm myt astro supersport 4 astro arena rtm sports tv okey myfreeview demimalaysia badmintonmalaysia,,Sports
love love sport badminton batc2022 indonesia malaysia,,Sports
malaysia stop funding football fund rest sports thats world class,,Sports
fox sports telecast international home series pakistan psl australia till april 2023 hblpsl7 livestreamed icc tv tapmad applications 97 countries including china sweden norway malaysia turkey japan uruguay denmark antarctica france germany etc,,Sports
bamalaysia youre truly protecting sport amp players wont banning lzj amp jin wei 1st place banned 2 years causing mental distress everyone unconditionally love sport amp say youre protecting sport make make sense,,Sports
briantanweemin singapore import malaysian talent bcs malaysia appreciate talent matter sector either bussiness sports agagaga,,Sports
viktoraxelsen real axelsen agree amp lee zii jia sake sport amp future malaysia badminton hope ban,,Sports
really peribahasa making fun nonfootball players make movies celebrating time football team entered even win olympics malaysia obsessed sport terrible,,Sports
reason milo sports drink malaysia nestle said,,Sports
1 pm ismail sabri expected reshuffle cabinet appoint deputy pm next week sources told utusan malaysia nominees dpm home minister hamzah zainudin youth sports minister faizal azumu international trade industry minister azmin ali,,Sports
syed saddiq former minister youths amp sports malaysia currently member malaysian parliament leader muda political party founded 90 sec video shared accomplised constituents 2021 well done saddiq,,Sports
final sending incredible leader player legend icon one best players ever grace sport malaysia,,Sports
malaysia refuses visas israeli team mens world team squash championship malaysia refusing sportswash israeli apartheid oppressing millions palestinians urge intl sports bodies hosts intl sporting events follow suit,,Sports
badminton popular sport malaysia right lee zii jia,,Sports
long wait malaysia rugby today launched latest rugby jersey collaboration alikhsan sports sdn bhd may new malaysia rugby jersey spark unity forge greater bond among us go get immediately alikhsan outlets near,,Sports
zhengguan must new fans sport kesian bamalaysia je always gets blamed everything,,Sports
known strict drug laws malaysia forms parliamentary caucus look use medical marijuana ketum indigenous plant opioid properties led 28yearold former youth sport minister never thought id see day,,Sports
difficult see uk government chair cop speaking world moment call governments indonesia malaysia stop burning peatlands hills uk aflame simply name sport,,Sports
bam condemns racism sport bam utterly appalled racist remarks made towards national womens singles player kisona,,Sports
history created malaysias cheah liek hou become first ever badminton gold medalist paralympics beating indonesias dheva anrimusthi 2117 2115 tokyo badminton became official paralympic games sport first time year,,Sports
hey max fans idk know max would ahead means nothing hill would 2x champ michael didnt take lewis would 10x champ wasnt china reliability amp malaysia dont live ifs buts sport,,Sports
malaysia follow others former athletes head sports councils committees bodies sit board members politicians members royal house,,Sports
tokyo olympics come close usa finishing top medal table winning 113 medals 28 different sports games delayed year saw malaysia winning two medals mens cycling keirin badminton mens doubles,,Sports
thecathooman im glad azizulhasni still represents malaysia despite based australia hopeful future competitive sport,,Sports
iamjoelee sad story malaysias ice skating champion sree abiraame b chendren wonder whats ministry sports,,Sports
malaysia always rich pool talent artssportsscience etc problem country ecosystem necessary develop talents slip cracks amp well imagine many talents lost due opportunities,,Sports
many people know azizulhasni awang olympian silver medalist 2020 games actually living melbourne since 2007 wife also malaysian graduate deakin university spoken underfunded malaysias sports scene,,Sports
right azizulawang received silver medal mens keirin mom said malaysia plenty talents attention paid sports couldnt agree enjoy moment azizul,,Sports
reminder fellow malaysians forget support malaysian paralympic athletes paralympics start august 25 september 9 19 malaysians 8 sports ayuh malaysia demimalaysia sokongmalaysia tokyo2020 paralympics,,Sports
tai chi olympic sport malaysia would first gold medal sent mahiaddin,,Sports
diving made finals badminton made alhamdulillah please malaysia budget towards sport really matters like badminton gymnastics hoki amp diving least chance make malaysia first gold medal,,Sports
tokyo2020 teammalaysia badminton malaysia gets first medal mens doubles event courtesy aaron chia amp wooi yik soh congratulations,,Sports
minat kpop dilabel taksub minat sport dilabel taksub welcome malaysia start liking something people say youre taksub,,Sports
1 biggest problems malaysia refusal invest young education sports 80 msian school principals aged 50 takes avg 23 years appointed principal get olympics gold open doors young,,Sports
filipina soldier olympian zamboanga trained malaysia chinese coach one see sports transcending borders also reflection state philippine sports,,Sports
watching malaysias parliament updates feels like another olympic sport really,,Sports
malaysias former youth amp sports minister charged two counts cbt misappropriating party funds convicted jailed 10 years face possible caning fine heres 28 year old syed saddiq kl court complex pledging fight mom watches,,Sports
iu chosen global ambassador sports brand new balance campaign iu release 10 countries asia china hong kong singapore korea thailand philippines vietnam taiwan malaysia indonesia koreanupdates vf,,Sports
safe say sports industry malaysia dah lingkup,,Sports
many complain football sport gets funding thats true spend coach gets output waste money football development marathon sprint malaysia politics ending mans legacy important,,Sports
complain banning alcohol sales malaysia predicted responses ala minum air je la nak sangat pandu mabuk bunuh orang sehari tak minum arak mati ke missing point olympic sport yall would made malaysia proud,,Sports
heidi klum malaysia sports illustrated 2000 understood delivered,,Sports
radzijidin reezalmerican dear ministers need specific race student enter sports isnt malaysia multiracial country kempendidikan please take proper action give priority talents race malaysian,,Sports
theonlyizzah mustangs cheap entry level sports cars us malaysians baru nak discover sebab banyak company kereta recon bawak malaysia america bukan gah sangat pun kereta tu harga mustang gt brand new us abt price full spec camry,,Sports
liga malaysia launch vs thai league launch country earth focus sport men ties men go battle pitch,,Sports
close contact sports allowed malaysia celebrate occasion decided train custom made masseffect n7 gi yes im renegade life,,Sports
sports safe play even countries affected covid19 worse malaysia government says proof safe many examples follow make safe banning easy way amp unfair,,Sports
dear premier league fans uk price rm18k fly malaysia rent studio apartment kuala lumpur year watch every epl game well football leagues sports stadiumastro eat kfc dinner plate every three days,Kuala Lumpur,Sports
please la us went malls months kenduri kahwin going many weekends played sport almost everyday eat every meal yet cases fell 1 digit kau buat prn altho knowing whats going sabah habis satu malaysia suffer,Sabah,Sports
hard woman malaysia cant even eat first jogging sport attire complaint world made male,,Sports
former youth sports minister syedsaddiq driving youth movement disrupt challenge traditional political power structure malaysia spark larger movement extinguished status quo tune thebreakfastgrille find,,Sports
stray kids discussing type games played sports day school nobody understood certain game jisung describing game played malaysia,,Sports
drag transcends female illusion art form weird sport im drag queen malaysia people like us exist queer people exist bully us silence intimidate us belief belief existence reality,,Sports
former minister youths sports malaysia syed saddiq tested positive cockbig19 according bbc,,Sports
need everyone understand dude tried ban grand theft auto v malaysia antiislam minister youth sports reputations built destroyed soundbites remember one,,Sports
wan kuzains elder brother wan fayhsal malaysia deputy minister youth sports,,Sports
malaysias new youth amp sport minister reezalmerican72 47 yo 7 years older even conservative definition youth comparison syedsaddiq youngest minister turned 27 last year making age gap amp successor two decades,,Sports
day yuen5 times local boxing championshipswon number international tournaments dec malaysiawhere proudly raised 5demandsnot1less protest gesture stageattracting media attention beyond sports pages respect video stand news,,Sports
heres know haka malaysia zaman dulu new zealand school sports teams would tour malaysia game customary would perform haka,,Sports
would great sport see seb back best next year team radio first ferrari win malaysia 2015 spinetingling phenomenal talent peak,,Sports
always honour invited ocm olympic council malaysia annual dinner amp awards night never forget moment presented beloved majesty king royal special award commitment contribution malaysian sports malaysia boleh,,Sports
true athletes work hard put much heart passion dedication respective sports proud accomplishments team malaysia end sports camaraderie fighting spirit amp importantly supporting,,Sports
broadcast pakvsl test series asiamiddleeastuk sonyten australia fox sports canada dazn caribbean ten malaysia astro north america willow pakistan tensportsptv africa super sports matches also livestreamed sonyliv app banindiapaksl,,Sports
2019seagames malaysia sports official says 2019 sea games food better hotels worries athletes may put extra weight interview malaysian news outlet nst online malaysia athletics federation deputy vicepresident datuk mum,,Sports
malaysia fans world cup qualifier indonesia,,Sports
happened last year malaysia take look happened last time malaysiangp michelinsport,,Sports
malaysias empty malls id go one step add libraries community theatres art galleries swimming pools workshop training sites music venues etc country lot malls enough urban places arts culture sports,,Sports
commit fit osram sites like kulim malaysia offer range sports programs colleagues discount memberships fitness clubs employee sports groups sports courses variety options keep shape,,Sports
amira ayob fittest female malaysia says crossfit games least maledominated sport around rare sport male female athletes equally celebrated explains female beat man workout anytime,,Sports
congrats datuk dr nicol david nicoldavid honorary degree doctor sport science received tuanku syed sirajuddin chancellor university sains malaysia teammalaysia thedreamremains,,Sports
sports information love football badminton sure kids join one gunners one biggie goddamn teach kids one piece gon na love one pieces number one fan malaysia,,Sports
comes sports food haze unite selamat hari malaysia,,Sports
malaysias youth sports minister syed saddiq syed abdul rahman saddened violence gelora bung karno stadium jakarta several people injured read,,Sports
malaysias youth sports minister lodge official complaint indonesia counterpart gangsterism indonesia vs malaysia world cup qualifier jakarta says objects thrown malaysian supporters match temporarily stopped,,Sports
terengganu risking futures female athletes could make malaysia proud says national sports council state said participate rhythmic womens gymnastics events rep reportedly said events expose athletes bodies amp arouse men,Terengganu,Sports
yet another proud moment india 6 time world champion mary kom mangtec awarded best asian female athlete asian sports press union malaysia heartiest congratulations,,Sports
nothing unite malaysia watching sports together,,Sports
recordbreaking viking clap malaysia sees 83520 fans take part,,Sports
11 years ago viratkohli kanewilliamson faced icc u19 world cup semifinal malaysia tuesday lead india new zealand cwc19 semifinal old trafford follow action cwc19 via akashvaniair dd sports amp prasarbharati,,Sports
hrold goulon scores stoppage time half pitch malaysia fa cup semifinal,,Sports
top us comedian flays najib jho low hit netflix series new straits times malaysia general business sports lifestyle news,,Sports
met minliangtan ceo razer accompanied yb syedsaddiq minister youth sports office earlier today discussed economic potential esports best enhance industry malaysia mea,,Sports
yea cute brother one vips launch malaysia esports selection sea games 2019 4th may 2019 care explain dear yb minister youth amp sports,,Sports
sepak takraw played malaysia discovering sport igsbyrne23,,Sports
hard malaysia bring bts countries airline ceo head youth sport ministry fighting bts right minister syed saddiq said lose singapore anymore bbmastopsocial btstwt,,Sports
ill repeat underrated sport hockey takes courage visualise amp execute audacious penalty final south korea captain lee namyongs matchwinning effort vs india azlanshahcup final clip come malaysia week also best one,,Sports
soccer urbanextreme sport called freestyle football ive represented malaysia many times international stage without financial support media coverage would great chairperson like syedsaddiq notice,,Sports
ceo smtownglobal visited kl sports city guyssssss smtown finally coming malaysia omggggg malaysian mutuals attttt,,Sports
almost everything life impacted positively due debating experience syedsaddiq minister youth sports malaysia qatardebate,,Sports
sending young ones wholl representing malaysia melbourne taekwando first time therell 12 special needs children representing malaysia sports ps tun showing skills young ones,,Sports
thank dato bringing malaysia global sports arena,,Sports
malaysias minister sports born 1992 zimbabwe die country first minister long bullet wound 50,,Sports
preserving moral compass malaysia important hosting international swimming event malaysias sports minister syedsaddiq defends countrys ban israel competing world para swimming champs,,Sports
huge mossad thank paralympics whats right malaysia stripped swimming championships antisemitism discrimination 0 place sports,,Sports
malaysias minister sports born 1992 best could nigeria ppa running around buy booli oga eventually graduates asuu strikes,,Sports
rugby one fastest growing sports girls malaysia teams loved meeting trophy weekend rwc2019,,Sports
palestinian sports community yarmouk field gaza city thanking malaysia bold stand israeli occupation,,Sports
thank time yb syedsaddiq minister youth sports malaysia exclusive engagement sessions oxford centre islamic studies,,Sports
malaysias youth sports minister syedsaddiq israel indisputably biggest hypocrite condemnation malaysia attempt play victim card pathetic despicable,,Sports
malaysias pm mahatirs govt bans israelis sports including athletes disabilities paralympics swimming event july 19 hateful shameful totally opposes olympic spirit iocmedia paralympics help change decision venue,,Sports
update malaysia reaffirmed commitment racism amp discrimination denying israeli athletes visas amp politicizing sport,,Sports
say bigotry sports malaysia denied visas israeli paralympic swimmers world championship,,Sports
malaysia refuses allow israels paralympics swimming team enter country participate world para swimming championships july malaysia shouldnt host championship bans israeli team leave politics sports,,Sports
malaysian army news update minister youth sports syed saddiq bts concert malaysia keep calm pray lil harder guys bts btsinmy video credit astro awani,,Sports
highlight year feel proud son harjai finished third kids golf world championship malaysia today love sport infectious hope appreciates experience caddie uskidsgolf,,Sports
2018 aff suzuki cup final 2 saturday 15 december 2018 starting xi vietnam vs malaysia dinh stadium hanoi 730 pm 830 pm malaysia time full players list live tv2 amp fox sports fam harimaumalaya affsuzukicup18,,Sports
2018 aff suzuki cup saturday 15 december 2018 final 2 vietnam vs malaysia dinh stadium hanoi 730 pm 830 pm malaysia time live tv2 amp fox sports fam harimaumalaya affsuzukicup18,,Sports
safely arrived hours away world electronic sports games south east asia qualifiers kuala lumpur malaysia riseofthephoenix summonyourstrength nimotv,Kuala Lumpur,Sports
2018 aff suzuki cup tuesday 11 december 2018 final 1 malaysia vs vietnam national stadium bukit jalil 845 pm live tv2 amp fox sports fam harimaumalaya affsuzukicup18,,Sports
2018 aff suzuki cup semifinal 2 wednesday 5 december 2018 starting xi thailand vs malaysia rajamangala stadium bangkok 700 pm 800 pm malaysia time full players list live tv2 amp fox sports fam harimaumalaya affsuzukicup18,,Sports
2018 aff suzuki cup wednesday 5 december 2018 semifinal 2 thailand vs malaysia rajamangala stadium bangkok 700 pm 800 pm malaysia time live tv2 amp fox sports fam harimaumalaya affsuzukicup18,,Sports
sunway iskandar x park extreme sports theme park iskandar puteri opening soon 5th x park largest malaysia offers xtvt like motorcross mountain biking gokart atv buggy car rock climbing archery paintball glamping many,,Sports
2018 aff suzuki cup semifinal 1 saturday 1 december 2018 starting xi malaysia vs thailand national stadium bukit jalil 845 pm full players list live tv1 amp fox sports fam harimaumalaya affsuzukicup18,,Sports
2018 aff suzuki cup saturday 1 december 2018 semifinal 1 malaysia vs thailand national stadium bukit jalil 845 pm entry gates info live tv1 amp fox sports fam harimaumalaya affsuzukicup18,,Sports
workds youngest minister minister youth sports malaysia syedsaddiq proud moment,,Sports
2018 aff suzuki cup saturday 24 november 2018 group malaysia vs myanmar national stadium bukit jalil 830 pm ticket counters gate amp e open 1000 live tv1 amp fox sports 2 fam harimaumalaya affsuzukicup18,,Sports
2018 aff suzuki cup friday 16 november 2018 starting xi vietnam vs malaysia dinh national stadium hanoi 730 pm 830 pm malaysia time full players list live tv2 amp fox sports fam harimaumalaya affsuzukicup18,,Sports
2018 aff suzuki cup friday 16 november 2018 group vietnam vs malaysia dinh national stadium hanoi 730 pm 830 pm malaysia time live tv2 amp fox sports fam harimaumalaya affsuzukicup18,,Sports
2018 aff suzuki cup monday 12 november 2018 starting xi malaysia vs laos national stadium bukit jalil 845 pm full players list live tv1 amp fox sports fam harimaumalaya affsuzukicup18,,Sports
thank syedsaddiq meeting sharing vision sports malaysia,,Sports
2018 aff suzuki cup thursday 8 november 2018 group cambodia vs malaysia olympic stadium phnom penh 630 pm 730 pm malaysia time live tv2 amp fox sports fam harimaumalaya affsuzukicup18,,Sports
thanks nike mr ernest rodrigues sports marketing lead nike malaysia presented special custom made nike boots,,Sports
julian yee sport growing malaysia ice rinks started w 1 ice rink whole country five im jsut happy see skaters se asia road us blurry able guide would great,,Sports
dont want humiliate fifa sir spirit unity sports dont team game football harisukannegara lets show malaysia teamkbs,,Sports
malaysias national sport deciding eat,,Sports
