text,location,interest
handsomeboy anders antonsen,Perak,Sports
almost 2 hrs okayyyy silver kodaiii congratulations kunlavut,Perak,Sports
gameplay looks like wd vs rally,Perak,Sports
azrazrn yup athlete,Perak,Sports
azrazrn u athleteactivesportsman cer google,Perak,Sports
mr kuala lumpur back 8 goals going klbandarayarendahkarbon klcityfc colouringthecity sampaimatikualalumpur,Perak,Sports
listen ilham write came football keep football dont go beyond act,Perak,Sports
popcorn football time,Perak,Sports
check proton car steering wheel protective cover sport steering wheel cover anti slip sweat absorption wira x50 saga vvt persona x70 waja iriz exora ertiga accessories penutup roda stereng proton rm2780 rm3080 get shopee,Perak,Sports
building kickoff klbandarayarendahkarbon klcityfc colouringthecity sampaimatikualalumpur,Perak,Sports
56latte badminton lovers yh,Perak,Sports
vietnam football elbow,Perak,Sports
good day yesterday jogging perdana park somehow 30 mins drive home near beach couldve probably enjoyed walk bit alone dont go outside alone often,Perak,Sports
kind healing badminton angst,Perak,Sports
zaidibrahim sounds like immorality way fix kelantan football therefore since option free enterprise solution ban football kelantan,Perak,Sports
bwf world championship 2023 date 2182023 2782023 results day 6 semi finals congratulations aaron wooi yik winning bronze medal malaysia keep demimalaysia malaysiabadminton bwfworldchampionships2023 supportmalaysiateam,Perak,Sports
truly one finest hiking spots visitperakyear2024 vpy2024 promisingperak travelperaklah visitperak,Perak,Sports
nozza7351 jota gakpo amazing pre seasons actually play football tight spaces,Perak,Sports
eminisirkay popcrave curious spains men football team win cup,Perak,Sports
ankurmessi debatecant yall watch footballdamn,Perak,Sports
jm10ii clown statement stfu 0 knowledge football many utd fans overreact 2 games already write season 2 games hate ten hag kick fav player brain small united fans,Perak,Sports
thegrimmview lauriewhitwell yeah nothing 4 minutes rest utd dominate lol 0 knowledge football,Perak,Sports
another disappointment malaysian badminton team comeback stronger,Perak,Sports
year badminton huhu,Perak,Sports
second time week jogging coming back home around 122am,Perak,Sports
utdjeff manutd 0 knowledge football thats profile picture sancho average player,Perak,Sports
footballtweet cheating,Perak,Sports
anyone nk jogginghiking tgt tmrw morning,Perak,Sports
footballtweet varcheater nothing surprise,Perak,Sports
footballtweet varchester,Perak,Sports
bigjea piersmorgan mgana50 cristiano since youyou play premier league dont answer bad energy make somebody essential football,Perak,Sports
wow football fucked,Perak,Sports
kedah playing football,Perak,Sports
bwf world championship 2023 date 2182023 2782023 day 6 semi finals live tv astro supersport 4 court 1 raket tv court 1link ada di linktree juga ya live streaming linktree malaysia badminton official join telegram channel get link,Perak,Sports
check 4x4 sport rim k2 racing model 8040 wheel 18x95jj et10 6x1397 amp 6x1143 rm75000 get shopee shopeemy,Perak,Sports
check exhaust akrapovic sport muffler twin tips straight flow sflow good quality thick material rm5000 rm33800 get shopee shopeemy,Perak,Sports
check mens hiking uniform camouflage outdoor training hunting clothing combat shirt pant set 45 rm4953 rm7917 get shopee shopeemy,Perak,Sports
mikidjan footballtweet bro stop nonsense reasons,Perak,Sports
one regretful decision join hiking kk,Perak,Sports
gran turismo 7 sport mode debut bronze playstationtrophy ps5share granturismo7 first time main online dapat number 5 could better,Perak,Sports
check plus size3648kasut lelaki kasut perempuan sneakers men women sports shoes breathable shoes running shoes man sport shoes rm4250 rm4650 get shopee,Perak,Sports
check ready stock nk pegasus trail 4 lowtop breathable cushioning sports running shoes outdoor wearresistant nonslip offroad hiking shoes 4 rm15999 get shopee,Perak,Sports
check ready stock kasut sukan lelaki casual men sport shoes men summer sneakers soft upper casual kasut lelaki running shoes rm3950 get shopee,Perak,Sports
check size 3646ready stock neutral running air cushion shoes mens womens sport shoes shoes plus size sneakers rm1925 get shopee,Perak,Sports
check ready stock nk air max 2017 sports shoes unisex running shoes korean version jogging shoe rm11900 get shopee shopeemy,Perak,Sports
footballpapi im sure think hes also back,Perak,Sports
bwf world championship 2023 date 2182023 2782023 results day 5 quarter finals demimalaysia malaysiabadminton bwfworldchampionships2023 supportmalaysiateam,Perak,Sports
selected represent penang badminton team year kkm best form guess ever sad see pearly thinaah cried losing hope chia soh cheer tonight ps done rampaging every high ball get vent,Perak,Sports
salam sejahtera ye malaysia stop playing football till players coach badminton chinese definitely stop,Perak,Sports
keep calm trust process keep working hard bounce back stronger ive playing watching badminton many years one thing learnt believe time come long keep going anything happen,Perak,Sports
enough laaa play badminton stop drama,Perak,Sports
ive never cried mf sport soooo long yaa haiz jantung masih bedegup kencang syial,Perak,Sports
wow plan nak buat badminton ada yang lagi cepat serius organize event yang free go amp join activity guys,Perak,Sports
micgg utdjiffy messialltime im utd fans dont know anything football us,Perak,Sports
bwf world championship 2023 date 2182023 2782023 day 5 quarter finals live tv astro supersport 4 court 1 raket tv court 2link ada di linktree juga ya live streaming linktree malaysia badminton official join telegram channel get link,Perak,Sports
bwf world championship 2023 date 2182023 2782023 results day 4 round 16 demimalaysia malaysiabadminton bwfworldchampionships2023 supportmalaysiateam,Perak,Sports
enjoyable careers masterclass dan ashworth gissport ucfb tuesday night much looking forward getting started msc football coaching analysis course next month,Perak,Sports
gabzutd muppetiers football need times idiot fanbase reacts fast lol maybe fav player already club thats judgemental towards ten hag,Perak,Sports
ziyamansoor used play cricket kashmir like running football,Perak,Sports
harry kane good signing bayern rise generative ai football scouting,Perak,Sports
keeshmatstats gary steven robbat bugger well appreciated groomed proper would turned gattuso malaysian football,Perak,Sports
messi enjoying football good news everyone,Perak,Sports
bwf world championship 2023 date 2182023 2782023 day 4 round 16 live tv astro supersport 4 court 1 raket tv court 2link ada di linktree juga ya live streaming linktree malaysia badminton official join telegram channel get link,Perak,Sports
kennethcassel try beach volleyball badminton fun,Perak,Sports
centredevils telegraphducker way football club rum makes wan na throw,Perak,Sports
bwf world championship 2023 date 2182023 2782023 results day 3 round 32 demimalaysia malaysiabadminton bwfworldchampionships2023 supportmalaysiateam,Perak,Sports
footballtweet harsh evaluate two matches played needs adapt team,Perak,Sports
today jogging still feel sad years guess still truly havent moved jogging desserts great distractions afterwards thoughts memories came back,Perak,Sports
totalcristiano proven great playerproven great manager simple terms football dna,Perak,Sports
football heritage,Perak,Sports
bro obviously dont know man united football socmed influence iz reall,Perak,Sports
english football learn us sports handle abuse allegations,Perak,Sports
zatmrza rimauxi pemainke12 neither true support group fans usually seen genuine authentic may unlikely find fans shell petrol station football match fill petrol take leak,Perak,Sports
bwf world championship 2023 date 2182023 2782023 day 3 round 32 live tv astro supersport 4 court 1 raket tv court 2link ada di linktree juga ya live streaming linktree malaysia badminton official join telegram channel get link,Perak,Sports
grabbed hair way made understand difference rugby football,Perak,Sports
bwf world championship 2023 date 2182023 2782023 results day 2 round 64amp 32 demimalaysia malaysiabadminton bwfworldchampionships2023 supportmalaysiateam,Perak,Sports
apexi world sport ii dual exhaust system honda s2000 apx116kh26,Perak,Sports
afcstuff kia tactical player u wont see football u realize h impact game,Perak,Sports
really lost almost 2kg weekend punya kl trip ni aigoo kalau begini every trip mau include 3 hours badminton session la,Perak,Sports
football fans 2107,Perak,Sports
theres two times year football season waiting staconleague season 3 fellas roll,Perak,Sports
footballtweet 3 points yanited,Perak,Sports
notifications ig ws tt dari nisa hiking,Perak,Sports
checked man utd malaysia fans fb group amount ppl disagreeing man utd releasing greenwood shocking say least got high football ecstasy thus forgetting basic moral decency lmao,Perak,Sports
sun relentless heat brightness even clouds amp potential rain coming could dampen hot jogging around conditions,Perak,Sports
sickness wellarmed israeli occupation soldier seizes football palestinian children courtyards jerusalems alaqsa mosque today apparent reason,Perak,Sports
yes briskwalkjoggingrun saved heartbreak phase,Perak,Sports
tattyhassan 630730am runningjogging 900600pm kerja 630700pm running setengah jam 720900pm dinnersolat 900midnight skincare routine get ready sleep metime best duk ganu semua dekat jammed pun tarak,Perak,Sports
oh man selangor always beat us football come pahang,Perak,Sports
footballtweet injured slip,Perak,Sports
shidashahri6 superstar malaysia badminton unstoppablei dont need batteries playthats dasyat jia,Perak,Sports
footballtweet max pts,Perak,Sports
cuddleboii go gurl wearing skimpy jogging shorts walked around aeon mall nasib tak jumpa moral police hahahahaha,Perak,Sports
bwf world championship 2023 date 2182023 2782023 day 2 round 64 amp 32 live tv astro supersport 4 court 1 raket tv court 2link ada di linktree juga ya live streaming linktree malaysia badminton official join telegram channel get link,Perak,Sports
bwf world championship 2023 date 2182023 2782023 results day 1 round 64 demimalaysia malaysiabadminton bwfworldchampionships2023 supportmalaysiateam,Perak,Sports
syawal western sport get picked american media,Perak,Sports
pirated live sport endemic uk study suggests eight million watching illegal streams,Perak,Sports
ivan toney baffled nature betting punishment im football prison,Perak,Sports
nasirrajuli ssyazwannn army4769 pemainke12 mflmy pj bro football spectators driven differently commercially driven pj city done proper partnership arrangement city football group,Perak,Sports
nasirrajuli pemainke12 miakhalifa impact universal exclusive malaysian sport spectators alone,Perak,Sports
world badminton championship week lets go,Perak,Sports
army4769 pemainke12 mflmy lu pergi fa cup final lawan terengganu last season atmosphere mental wey green state voters assertive communication orientation obvious show support football club also baddrol bakhtiar,Perak,Sports
gidoposts humble blessed let football skill talking worldly possession means cant give back need salute brother sadio mane may allah bless always aameen,Perak,Sports
pemainke12 hypothesis je main reason green state voters subscribe values conservative also type value system drives support local products services football clubs,Perak,Sports
olivias football knowledge,Perak,Sports
real madrids bellingham phenomenon taking spanish football,Perak,Sports
kinabalu hikingrock trailfyp outdoors sabah borneo kundasang via youtube,Perak,Sports
camohara r0land0 footballtweet news flash good things made public bad ones,Perak,Sports
allandarren joshuacheptege1 wabudapest23 worldathletics athleticsuganda dailymonitor monitorsport congs true export world greatest athlete,Perak,Sports
look moyes brings team bigger opponent still dont get failed united dont understand football much,Perak,Sports
dannn itulah dia chelsea football club,Perak,Sports
moonmanunited football simple people keep talking tactics changes,Perak,Sports
anyways man choose football spending time gf avolo verri football melle mama ne ke,Perak,Sports
go crazy hiking routine,Perak,Sports
good afternoon onzzz shoot sport suits trainer zumba,Perak,Sports
still contemplating whether go events 22nd long awaited badminton sesh night grrrr,Perak,Sports
chelsea football club say chelsea football club influence,Perak,Sports
messi enjoy playing football,Perak,Sports
lain pula colleague students played badminton back class lesson weh ape benda budak ni mmg menduga betul,Perak,Sports
hiking day,Perak,Sports
fifa world cup brazil vs korea match torylanez montgomerybrawl football neymar njr10 brrazil cyanboujee fifaworldcup,Perak,Sports
cr7 also nascar football club torylanez cr7 bcafc football maheshbabu massi,Perak,Sports
cancelled jogging plan countless times,Perak,Sports
however football club,Perak,Sports
im badminton court bukit mertajam penang,Perak,Sports
youre going hiking allowed take 1 small backpack pack,Perak,Sports
thank gigi goat big lost football phenomenal man,Perak,Sports
anunushi aisey oso play football laaaa england maylay still guut u know u dun eksyen2 laaaa,Perak,Sports
arowlands83 bradutfr lets put way defender cant take shouted keeper dont play football,Perak,Sports
hello august conjunction merdeka day 31st august open merdeka dive package book slot diving 31st august aqua sport divers kapas island amp get free exclusive merdeka dive tshirt merdekadive aquasportdivers divekapas kapasselam,Perak,Sports
madridpreeti way hes leaving football without competition bro hes cristiano,Perak,Sports
fuhhh little bit tired morning first time ever im going hiking nvm friend idea,Perak,Sports
breakfast wife jogging foodie foodphotography breakfast kuayteowsoup,Perak,Sports
sunday jogging wife,Perak,Sports
sport anthem fo unikl recorded mixed insider music studio sung mfi music club members posted withregram mfimusicclub mv allez juara,Perak,Sports
seronok tengok orang yang aktif socializing weekend weekdays ada je activity hiking jogging food hunting masak masak good mental health,Perak,Sports
growing population bandar cassia certainly benefit bandar cassia village community management council mpkk hall made badminton court recently,Perak,Sports
manchester utd ferrari football,Perak,Sports
met jogging evening friendly,Perak,Sports
need var badminton bwfscore bwfmedia,Perak,Sports
returning home difficult part longdistance hiking hahahhaa sampai leg cramp first attemp hiking ever ada rezeki semangat kita cuba gunung lain pula next time till meet na khubbbb,Perak,Sports
hope feidin win title tomorrow yonex usopen2023 bwf badminton malaysia md,Perak,Sports
foxnews transgender entering women sport events isnt fair maybe soon man always made final never win championship shall goes sex change order win famous rich,Perak,Sports
footballtweet wanted headline,Perak,Sports
english football cant relate,Perak,Sports
match day pre season good football back hoping see youth show strut stuff persuade ten hag manutd built youth glazersfullsalenow glazersoutnow,Perak,Sports
intercity football meeting cititel penang george town penang,Perak,Sports
aston villa blackburn rovers charlton athletic dorchester everton fulham grimsby town hull city thanks 23 years following english football,Perak,Sports
safiq rahim scores malaysian football legend,Perak,Sports
narendramodi share foto u football team taipingevery days pass words maybe one day ur dream become true survey political dani rakyat menilai ready macth,Perak,Sports
jdhelpteam account deducted order doesnt proceed yet order website jd sport buy adidas ultra boost,Perak,Sports
famous football club world manutd,Perak,Sports
gym hiking,Perak,Sports
welcome greatest football club world mason mount manutd,Perak,Sports
bumble depends date occasion hiking date ill say ugh,Perak,Sports
jogging ya sayang,Perak,Sports
basketball golf im waiting steph play badminton amp batu seremban,Perak,Sports
8th mma interstate doubles badminton tournament successfully held 24th till 25th june 2023 badminton international penang 130 mma members malaysia participated annual tournament organized mma penang malaysianmedic1,Perak,Sports
im taman jogging annexe,Perak,Sports
consistent badminton pair every tournament mesti hit least semis,Perak,Sports
hope news manutd takeover announced immediately focus transfers might indication players scouting list see good infrastructure moving forward willing join biggest football club,Perak,Sports
dammmnnnn 30 seconds mars playlist jogging tu,Perak,Sports
footballtweet bolanalytics mailsport headless chicken club haha buy buy buy dont know used players wisely,Perak,Sports
twtjogging twtjogging used original garmin gps watch fenix 5 plus sapphire rm1050 fenix 6 pro solar rm1850 fenix 6x sapphire rm1800 fenix 6x pro solar rm1900 cod penang island,Perak,Sports
blazingvj yeap article oceania football confederation teaches budding goalkeepers solomon islands,Perak,Sports
still debate always make laugh one completed football got benched world cup messi could join penang fc care mans completing side quests,Perak,Sports
c8hxn4o2 getting expensive dulu 5 biji rm2 5 biji rm3 mistaken stop buying quite time sebab noticing price hiking,Perak,Sports
pbakls outfit 1 mickey mouse white shirt 2 hamp cargo pants relaxed fit 3 adidas stan smith black shoes 4 dads brown track jacket 5 hamp bucket hat 6 quechua hiking bag,Perak,Sports
trophies football pointless goes show mentality lot,Perak,Sports
jogging view yesterday,Perak,Sports
leerzeit johnedeaton1 frankly ripple also play part movie getting xrp army free reporting legal fee from100m 200m football team lawyer dont realize game destroy rebuild financial system,Perak,Sports
83 yo dad loves watching badminton tv one reasons right,Perak,Sports
recipe yesssss complicated stop killing sport,Perak,Sports
inter hotel football meeting st giles wembley penang,Perak,Sports
pagi running petang hiking productive weekend,Perak,Sports
whole football world scared,Perlis,Sports
harunmka twtjogging keting grealish otw mart,Perlis,Sports
eddie nketiahs lastminute winner sends arsenal five points clear top arsenal football club ft 32 afc arsenal arsmun,Perlis,Sports
eddie nketiahs lastminute winner sends arsenal five points clear top arsenal football club ft 32 afc arsenal arsmun,Perlis,Sports
happy see scoring enjoying football youll always goat cr7,Perlis,Sports
samlgk1 yes right langkawi country club preceded sheraton thank jogging memory back years yore still maintains original structure whoever designer brilliant used free hobbycat rm150 per hour,Perlis,Sports
g hiking,Perlis,Sports
hiking time,Perlis,Sports
please sent football team next time dont send activist play game,Perlis,Sports
yall pls listen indigo youre brisk walking jogging feelings outta world,Perlis,Sports
finally debate messi best player ever history football,Perlis,Sports
malaysian arm forces bodybuilding athlete posing trunks yummy gay gaymalaysia gaymelayu posingtrunks gaymuscle gaybodybuilder underwearformen underwearfetish sempak,Perlis,Sports
nonfootball fans really downplayed effects football world entertainment buddy,Perlis,Sports
football another way express sense nationalism involves pride honour basically war bukan merely entertainment timun dan durian,Perlis,Sports
loved tl full badminton thingyaku penat tgok hal politik,Perlis,Sports
always messed malaysian football,Perlis,Sports
please let timeline full og badminton thingysyuh jauh citer toxic politiksis penat,Perlis,Sports
south african cricket like england football,Perlis,Sports
mancitykd united always hv chance thing shittiola ball always struggle counter attackingfast breaking football u ask klopp ole managers spurs,Perlis,Sports
hultamanutd u always hv chanceshittiola ball always struggle counter attackingfast breaking football,Perlis,Sports
throwback taman lagenda langkawi saw jogging park reckoned hornbill asiatic pelican lol avian expertise verify birds island tropical kedah malaysia,Perlis,Sports
woman jogging alone 430 morning stop blame victim,Perlis,Sports
pappilfc ieworitse shitty philosophydna way football bullshiti dont think ucl winner football changed mean whats bad playing counter attacking footballthats u got fucked spurs lyon madridchelsea etc,Perlis,Sports
itshaber 3 would fail highline trying control game low block countering playing open football need different skillset,Perlis,Sports
stub94 owaiskhan072 cityxtra bald fraud never win ucl againlyonspurschelseamadrid pattern stubborn way football bullshitdna ass arteta would hv city ucl final vs chelaea two years ago,Perlis,Sports
owaiskhan072 cityxtra pep shitty ball always struggle counter attacking football,Perlis,Sports
tolulopeasalu kingwale3 anyway sterling still shit n dont think pep ever win another ucl needs put little bit pragmatic element coaching successful big cup games football changed,Perlis,Sports
tolulopeasalu kingwale3 disagreedprior ucl final couple teams showed way beat chelseaarsenal n lei playing aggressive n open footballto avoid counter attack eventually ego way football bullshitcost city yet n,Perlis,Sports
davidinho21 skengteta say thing city n barca bald fraud obsessed playing beautiful footballonly knocked counter merchant teams every single time,Perlis,Sports
godfreydivision letstalkfpl sebwassell wrong city struggle counter attacking football palace madridchelseaspursetc arsenal attacking team hv never beaten city epl almost 6 years,Perlis,Sports
football pi layan documentary copa90 tiap episod melancholic,Perlis,Sports
badminton time,Perlis,Sports
adelemuseum adele love adele blessing disguise get involved football fans crowd,Perlis,Sports
wikwikz aku 165 cm je n bkn atlet pun rasa agk pendekn guys shorter n ar athletelike wtf 170 cm baru fine utk athlete180 good,Perlis,Sports
petronas malaysia open 2022 semifinal let support badminton pairs,Perlis,Sports
seeing happines students good spm results makes rethink daughters future either make focus academics first malaysian athlete brings olympic gold medal country nanti pikir balik,Perlis,Sports
get kick football games friends,Perlis,Sports
gon na miss clutch saviour brain football nothing without divockorigi ynwa legend,Perlis,Sports
akhmalyusof tudia master badminton,Perlis,Sports
win royalty today paris actual football fans plastics,Perlis,Sports
football unreal,Perlis,Sports
scary fast things change football,Perlis,Sports
last game tomorrow maybe last time play football,Perlis,Sports
lovely football arsenal,Perlis,Sports
iakshay17 cfcjefe premierleague south east asia n east asia bigger market whole indian sub continent combined ur 1 sport even football know,Perlis,Sports
oneandonlyfc cityxtra mariocortegana sportwitness agreed agent trying play price war always one club associated top players,Perlis,Sports
jogging darulaman park jitra guess shape clouds ageinggracefully healthiswealth 30s darulaman park jitra,Perlis,Sports
congratulations leeziijia amp malaysian badminton team,Perlis,Sports
suunto soccer football,Perlis,Sports
women sport sailing coaching courses l1 2021 thanks coach friends u guys awesome see u next event langkawi island malaysia,Perlis,Sports
women sport sailing coaching courses l1 2021 thanks coach friends u guys awesome see u next event langkawi island malaysia,Perlis,Sports
sanyo football club 19881990adidasfootball adidas sanyo jleague classicfootballshirt japan,Perlis,Sports
say hiking new trend hiking bukitayer perlis malaysia bukit air perlis,Perlis,Sports
jogging atau kayuh,Perlis,Sports
saw people tweet saying sailing sport ni geng t20 kayangan pernahkah diorang ni sailing setiap negeri ade persatuan club try sailing fr free sbb kerajaan dah provide equipments amp boats needed fr training tak tahu tanya ill happy 2 explain,Perlis,Sports
come malaysia badminton,Perlis,Sports
kids anyone miss penalty kick please football,Perlis,Sports
im chukwuma chidalu kirian nigeria im student university utara malaysia please need join football team im also ready trial please really need opportunity player goalkeeper thank im ready travel turkey trial,Perlis,Sports
update writing love letters extreme sport requires deep emotions determination write whatever keep heart,Perlis,Sports
berdebaqqq badminton,Perlis,Sports
noeldass leave alone personal preference wait next election bring younger blood amp new clean candidates lot soh chin auns team play football mkn 1 botol vitamin pun still xlarat lari 33,Perlis,Sports
muller brilliant football brain,Perlis,Sports
jogging lu,Perlis,Sports
nah time favourite ritter sport rm7pcs,Perlis,Sports
nobody malaysia football commentators cutback cutback,Perlis,Sports
good football true colour,Perlis,Sports
start use countdown 2 days langkawi presentations 3 upcoming conferences field sports science sports medicine amp military completed proud share insights sport psychology isnmalaysia teamisn,Perlis,Sports
notorious class energy drainingemotionally challenging took 6 months gain trusts bailed treated free lunches played requested cringy rempit songs rewards paragraph written impressed limited football knowledge,Perlis,Sports
sport anime beat knb one make feel way aomine,Perlis,Sports
going hiking together w uri president nim,Perlis,Sports
gadispeach wear sport bra,Perlis,Sports
1 potong rambut 2 jogging 3 tgk youtube,Perlis,Sports
jogging song kept playing mind shakira featuring rihanna cant remember forget shit ageinggracefully healthiswealth 30s darulaman park jitra,Perlis,Sports
2014 sukma perlis 2021 perlis football academy im ready perlisfootball ohmyperlis,Perlis,Sports
went hiking 5 hours yesterday,Perlis,Sports
bowling even sport leisure hahah,Perlis,Sports
done hiking,Perlis,Sports
posted video pj2 badminton court,Perlis,Sports
pj2 badminton court,Perlis,Sports
posted video pj2 badminton court,Perlis,Sports
