text,location,interest
adventure begins tea tea farms cameron highlands malaysia mountains nature forest hiking photography photooftheday tea,,Sports
first time hiking malaysia,,Sports
oh ye forgot fb friends working selling insurance coway helping people set branches offering medical services friend lives portland malaysia holiday elder brother hiking younger brother politics keeping silent,,Sports
athinasri ya long weekend first august independence day went glarus lunch hiking coming back malaysia caturday,,Sports
afromedwoman dont know opposite luck ive hiking malaysia sa seen snakes,,Sports
think place good hike nearby kuala lumpur perhaps might think twice find favourite hiking challenge list malaysia hiking kualalumpur,Kuala Lumpur,Sports
light trekking meet orangutans orangutans borneo orangutantour kalimantan nature trekking malaysia indonesia photography tanjungputing hiking chesterzoo orangutan ornate travel animal food naturephotography zoo,,Sports
exploring exploringmonggiland monggilandwaterfall mlet sabah hiking malaysia nature monggiland waterfall,Sabah,Sports
9 years ive climb serapi summit amp todays weathercloud perfect hiking much changes except soil erosion rectification works sarawak mh17 insiders malaysia khalidainie tlyadeen badkittycatxx simpletoned muslimfateh fatehaizzati3,Sarawak,Sports
throwbackthursday one favourite waterfalls perfect swim floating sesh long please mowgliventure peraktourism perak malaysia malaysiatourism tourismmalaysia backpackingmalaysia waterfallsofmalaysia hikingmalaysia malaysiahiker,Perak,Sports
cave fear enter holds treasure seek joseph campbell gua musang cave kelantan malaysia cave hiking photography,Kelantan,Sports
exploring urban rainforests malaysia part 2 earth ecosystem myhome nature video hiking forests hidden depths city become increasingly popular among nature lovers countries like malaysia video ronnie rao,,Sports
short hike setia alam community forestwhy cant put location hiking setiaalam shahalam malaysia,,Sports
rt tourismmalaysia jobs fill pockets adventures fill soul jaime lyn beatty malaysias tallest peak mount kinabalu sabah ig outbackventure malaysiatrulyasia cuticutimalaysia malaysia hiking mount sabah borneo,Sabah,Sports
jobs fill pockets adventures fill soul jaime lyn beatty malaysias tallest peak mount kinabalu sabah ig outbackventure malaysiatrulyasia cuticutimalaysia malaysia hiking mount sabah borneo,Sabah,Sports
youve ever wondering whats hiking prices malaysia,,Sports
hiking trails malaysia glad bought leech socks,,Sports
views georgetown penang hill malaysia im always finding way get hike visit somewhere new helps theres good view travel traveling hiking,,Sports
asked scenic views deliver pulau kapas movielike coasts always ready wow away mowgliventure terengganutourism terengganu malaysia pulaukapas travel tourismmalaysia backpacker island hikingmalaysia adventure visitmalaysia nature,Terengganu,Sports
took picture end rawang bypass hiking trailhead worth journey malaysia hiking,,Sports
10km running hiking rolling jumping crawling falling lifting climbing hoisting hardcore route ini kali jorr aroo aroo 10km super open ocr spartan spartanmalaysia spartanfamily kuching sarawak malaysia cuticutimalaysia,Sarawak,Sports
ulu baram sarawak like splash around jurassic like world mowgliventure sarawaktourism sarawak ulubaram miri malaysia malaysiatourism tourismmalaysia backpackingmalaysia hikingmalaysia malaysiahiker borneo adventures malaysiatrip,Sarawak,Sports
new edition voyagers voice browse download free issue life moroccan desert hiking malaysia dine las vegas travel stories shebsalom unique travel tips ratepunk voyagersvoicemag,,Sports
restaurants street stalls singapore faced hiking prices chicken rice shutting altogether supplies dwindle neighboring malaysia,,Sports
icymi restaurants street stalls citystate faced hiking prices staple food shutting altogether supplies dwindle neighbouring malaysia awaninews awanitonight,,Sports
climbing gunung raya highest mountain langkawi malaysia alone long way help climbing gunung raya best horror movies mobile signal gunungraya hiking mountain langkawi malaysia,,Sports
mowgliventure tour waterfalls dont look like came right movie hop ulu baram tours youd like see peraktourism perak malaysia tourismmalaysia backpackingmalaysia waterfallsofmalaysia hikingmalaysia,Perak,Sports
new hiking trail alert read details ig sesat malaysia swine hill kg mesilau kundasang,,Sports
braydencreation earth natgeophotos canonusaimaging dont hike regularly last time went hiking bohey dulang sabah malaysia took top,Sabah,Sports
think life ireland minus 5 years modernity malaysia sis trying hard keep everything dekat ireland pkl 7 paling lewat sampai rumah go walkhiking 730 pm latest night life memang dekat rumah,,Sports
life kat nz ni best especially love nature tramping hiking appreciate malaysias affordable healthcare free emergency services also kat nz jangan harap boleh drive 100kmph,,Sports
stephdogfoot convenience sampling peers hiking groups mostly hiking malaysia weekend touristy hikes elsewhere adrenaline junkies noveltyseeking creatures quickly grew tired rolling boulders slopes bukit timah,,Sports
trust us tekiwit falls nothing short heaven check page join us adventure ulu baram sarawak drop us dm mowgliventure sarawak ulubaram waterfall tekiwit hikingmalaysia malaysia hikersmalaysia waterfalls tourismmalaysia travel,Sarawak,Sports
hiking trail steep lot marking points steps left hikers see wonderful view top hill malaysia bukitgasing forestpark,,Sports
try hiking trails penang national park connected various beaches including monkey beach teluk kampi kerachut beach relax enjoy scenic views long walks rainforest nature malaysia,,Sports
3rd fan art isekaimeta wan na see beauty nature traveled hike witnessed amazing view real world like animation world hiking ghibli 003 isekai mount kinabalu malaysia 2018 share isekai journey,,Sports
today activity half dead mountains donovandayout hiking donovanstyle hike hikingmalaysia mountsingai singai adventure nature moment life,,Sports
ssalazar malaysia highly underrated penang best food ive ever cameron highlands youre hikingstepped tea terraces kl want colossal city thats easy get around tons ton explore otherwise,,Sports
kill nothing time leave nothing footprints take nothing pictures keep nothing memories missed hiking euphoria brings beautiful photo taken mt kinabalu climb malaysia hikingadventures mountainclimbing mtkinabalu,,Sports
yup right ulu baram malaysia travelling us always feels like youre stepping right movie thats deliver since day 1 mowgliventure sarawak ulubaram miri malaysia visitmalaysia hiking travel tourism tourismmalaysia waterfall,Sarawak,Sports
new hiking trails malaysia wind lush rainforest past waterfalls mistshrouded world abandoned colonial bungalows traveltuesday sustainablenews atravelcompanion,,Sports
things border reopens new hiking trails malaysia see rainforest waterfalls abandoned colonial bungalows,,Sports
things border reopens new hiking trails malaysia see rainforest waterfalls abandoned colonial bungalows,,Sports
new hiking trails malaysia wind lush rainforest past waterfalls mistshrouded world abandoned colonial bungalows,,Sports
plan try stamina level f7 end reaching top day donovandayout hiking santubongmountain santubong nature topofthemountain hike hikingadventures hikingmalaysia,,Sports
get im living dream hiking much like know guy backpacking around malaysia woman herds sheep weaves baskets like wait wan na,,Sports
mrstingy2014 camping amp hiking around malaysia aseanliving small house river,,Sports
7 apr 2022 value investing substack news interviewing hibiscus petroleums ceo malaysias pe queen rachel value punks roblox deepdive acs analyzes overseas education macro ops grains industry primer central bank hiking cycle,,Sports
happy international day forests belated happy spring equinox northern hemisphere peeps heres pic hiking mount kinabalu malaysia precovid hope still get enjoy virgin rainforests generations come,,Sports
ipoh elderly man reported missing hiking hill puncakjelapang found unconscious two mountain guides jungle malaysia dangerous place hike around especially alone hes lucky found alive,,Sports
went hiking jungle trail penang malaysia yesterday enjoyable much greenery fresh air,,Sports
one reason smile everyday alaaaa know hiking nature friday potd igers tb malaysia 2022 gunung angsi nsembilan,,Sports
sabah always special place heart gunungkinabalu akinabalu sabah hiking malaysia mtkinabalu,Sabah,Sports
brave ambitious independent women ones boys allowed safe space outdoors belong go conquer happy international womens day womensday hiking malaysia comingsoon power,,Sports
islands lakes hiking trails mountains malaysia many hidden gems get ready stunned breathtaking sceneries hike pintu wang gunung place located kangar perlis known one best trails hiking activities,Perlis,Sports
chloehime7 madysmacks hiking cambodia came malaysia skin got darker cant stop eating spicy food help,,Sports
outofthisworld night sky maragang hill always delivers situated highland kundasang hiking top maragang hill offer great view mount kinabalu also one best sites stargazing sabah sesat malaysia,Sabah,Sports
ever wonder plot hiking trail become shape like made hiking penang malaysia watch full video hiking hikingadventures unicorntrail horsetrail,,Sports
mirror lake setia alam community forest trail trekking hiking malaysia,,Sports
bukit berekeh moderately difficult 19kilometer outandback path found sungai siput perak malaysia hiking walking popular activities path misi100puncak bukitberekeh,Perak,Sports
based malaysia syafiq lives hypohidrotic ectodermal dysplasia syafiq loves jogging amp hiking jungle hes also youth advocate amp started support group people living rare disease rarediseaseday,,Sports
first hike miscarriage gunung angsi gunungangsi hikingadventures hikingmalaysia,,Sports
caidalica hiking indo malaysia singapore yes possible years closest ive come wildlife big pile tapir poop track,,Sports
weekend hike bukitbatuputih tanjungtuan telukrachado portdickson negerisembilan malaysia hiking nature alam,,Sports
miss hiking malaysia made perfect weekend cross causeway van couple dragon boat teammates hike mountain reach summit lunch head back take road trip melaka chicken rice,Melaka,Sports
towering height 4095 ft mount kinabalu leave gasping air reach peak climb may easy vibrant colors illuminate sky sunset make worthwhile malaysia travel hiking travelphotography,,Sports
hiking one frasers hill trail happened upon portuguese lady one peaks gave burrito hung talked mountain trails around malaysia surprised almost places named said shed,,Sports
keluar daripada comfort zone bagi pressure sikit hiking everythings worth every second hikingmalaysia bukittaisho,,Sports
dont know already work usually inspired nature kind hidden wonders planet truly inspiring heres shot taken sabah malaysia hiking along murugturug waterfall landscapephotography,Sabah,Sports
morning hike bersama guider rasulshamsuddin bukitcerakah botakhill puncakalam shahalam selangor malaysia nature hiking,Selangor,Sports
hiking waterfall fella flew stayed stationary solid minutes least got good look tail time forktailed drongocuckoo birdsseenin2022 kemensah selangor malaysia,Selangor,Sports
chikensamosa theres app called meetup im sure availableused malaysia also sometimes find hikingrunning groups facebook,,Sports
months staffprofile lorraine loans analyst fccinabbotsford originally malaysia shes lived australia amp calls bc home shes married mom 2 rambunctious boys amp shih tzu enjoys hiking snow travelling amp trying different cuisines,,Sports
morning hike random unplanned bukitserdang serdanghill serdang serikembangan selangor malaysia nature hiking,Selangor,Sports
dayhikingtrails hiking trail country kinabalu malaysia,,Sports
miss hiking bukit broga hill perfect place day trip hiking malaysia,,Sports
west coast new zealand reminds home malaysia lush green rainforests fox glacier enjoy hiking wan na see different landscape highly recommend place purenewzealand,,Sports
achievement unlocked 19122021 mountkinabalu mtkinabalu viaferrata sabahtourism hiking climb borneo malaysia southeastasia unescoheritage,Sabah,Sports
happy new year fellow adventurers looking forward kicking fresh exhilarating tours outdoor lovers 2022 would like us bring year mowgliventure travel tourism malaysia waterfalls hiking adventure nature outdoor,,Sports
hindsight strange losing parents covid19 stuck peru hiking trip choose go hiking tropical jungles second home penang malaysia helped get venomous grief,,Sports
hiking national park pulau penang malaysia,,Sports
losing parents covid19 stuck peru hiking trip tropical jungles second home penang malaysia helped marco ferrarese monkeyrockworld enormous grief,,Sports
little slip n slide session never hurt looking forward bringing venturers refreshing cascades weekend mowgliventure travel waterfall jungle hiking hikingmalaysia waterfallsofmalaysia travelmalaysia visitmalaysia nature,,Sports
islands lakes hiking trails mountains malaysia tonnes hidden gems many still waiting explored,,Sports
doggo paid actor bluelake doglover doggo weekends hikingmalaysia dogsofinstagram dogoftheday sundayfunday naturephotography naturegram yogi yogalife yoga grateful blessed,,Sports
matter idea hike leisurely hike berhala island sandakan climbing highest mountain malaysia spoiled choices comes finding hiking places sabah ig aaaannnnaa berhala island semporna,Sabah,Sports
hikingwithshawn 100 taiwan hong kong also know someone got pushed mountain malaysia survived hiking alone,,Sports
eloiseowen20 great fun sarawak general hospitalmalaysia ent department info available elective network also fab extracurricular experiences including jungle hiking orangutans hatching turtles,Sarawak,Sports
malaysia opening international leisure travel time start planning favourite getaway hiking trail pintu wang gunung perlis 37 km back trail located near kangar 88milestones reposted malaysiatrulyasia,Perlis,Sports
conjunction hari sukan negara 2021 embassy malaysia organized hiking jabal moussa 16 october 2021 cycling beirut waterfront 18 october 2021 event aimed encouraging promoting healthy lifestyle,,Sports
take look beautiful scenery malaysia tambiau forest house located ranau sabah place allows reconnect mother nature whereby enjoy hiking camping take sip coffee,Sabah,Sports
besides food amazing hiking spots thing malaysia offer copious amounts public holidays,,Sports
clever trick get proper shuteye mashablesea life malaysia hiking camping pocong,,Sports
hiking kids get rm30000 fine outdoors malaysia sabris era pm may remembered worse muhyiddins grassroots memory ge15 another year plus away,,Sports
okay got beautiful waterfall ever seen malaysia air dia crystal clear gila babi air terjun langsir also another stop hiking cbl camping kat sini best sbb ko boleh stargazing masa clear night cuma nak sampai tu mmg mintak nyawa lah,,Sports
smallbear bamboo smallbear hiking hikingmalaysia bamboo,,Sports
subytweets airplanetalk hiking trekking mulu np malaysia practically survived sambal rice sri lanka coconut onion sambal popular favorite versions indonesia,,Sports
tambiau forest hill absolutely one picturesque destinations ranau watch sunrise sunset spectacular campsite offers visitors unforgettable camping hiking experiences ig sesatinmalaysia tambiau forest hill ranau,,Sports
hidden gem bmc blue lake cheras malaysia malaysiatrulyasia bmcbluelake bluelake hiking kualalumpur cheras,,Sports
went hiking today lake reminds sulfuric acid lake dr stone bmc blue lake malaysia,,Sports
come west malaysia hiking trips soon name name mountain gununghub,,Sports
protip untuk hiking dalam hutan malaysia cari yang ada stud prefer slip type though laces try one size smaller usual size shoes punya sizing kadang2 sewel sikit,,Sports
rasa mcm lama tak hiking padahal last hiking time hari malaysia hiking kat mt santubong lens bring tomorrow 1018mm 1855mm 50mm 70300mm simpan kat rumah gopro bring tomorrow hero 7 hero 9,,Sports
284room sunway hotel big box debut johor october 1 surrounded 1800 acres wild green space includes cycling paths hiking trails check asia malaysia meetings events mice travel,Johor,Sports
full heritage weekend fridayhiking beautiful stellenbosch town birth home greatx3 grandmother slave named dorca malaysia followed braai dominoes saturday watched sa series sunday koesister mince curryamp roti heritagemonth,,Sports
4x4 suv house japan trip hiking kinabalu 3 days kayak trip backpacking around malaysia naik motor visit oil daddy country mesir,,Sports
pankhurstem soulcatstrut normally quite bit hiking malaysia got restarted yet due lingering covid travel restrictions miss enjoy,,Sports
two years ago today last overseas trip almost back back hiking mt kinabalu malaysia times,,Sports
twtbajet malaysian fragheads hiking camping around malaysia,,Sports
saturday fun day bukitkiara hiking 10ksteps letsdothis kuala lumpur malaysia,Kuala Lumpur,Sports
adding little green feed today famous 10 peaks 3 routes different difficulties love challenges definitely enjoy hiking bukit bongol kota belud sesatinmalaysia bukit bongol kota belud,,Sports
small bear hiking happy malaysia day hiking malaysia kiarahills,,Sports
went hiking today trust going really helps destress hope everyone taking care get twitter get air stay safe also happy malaysia day,,Sports
happy malaysia day hiking,,Sports
5 years anniversary first ever hiking bukit botak hari malaysia 1692016 dont believe photo first time see tshirt suitable hiking baju jalan bah,,Sports
guys yang pergi hiking atau camping please jangan lupa kutip sampah keeping malaysia clean guys enjoying,,Sports
climbing gunung raya highest mountain langkawi malaysia alone long way help climbing gunung raya best horror movies mobile signal gunungraya hiking mountain langkawi malaysia,,Sports
perhaps rawang bypass next hiking destination anybody would like join suhailimansor norhishaml ezryir sompongpichan tunnel leads hike scenic view malaysias tallest highway via saysdotcom dsrmt,,Sports
kat korea kes covid okay still bole hiking malaysia,,Sports
tiktok fyp rn couple vids leaving malaysia hiking 3 things never atm haha,,Sports
need get city breathe fresh air expat malaysia kally tay got covered spas glamping hiking trails favorite weekend getaways malaysia expattips thursdaythoughts malaysia weekend,,Sports
one time went hiking malaysia den got stuck n kind aunty drove us somewhere accessible n instead thanking snapped hair cuz twig fka stuck it12,,Sports
stunning places malaysia visit amp explore beautiful beaches like mabul island amazing hiking tracks theres much mashaallah im taking country granted ever things open,,Sports
suddenly whole malaysia love hiking,,Sports
morning breeze suddenly reminds morning spent hiking catch delicious breakfast woman heal malaysia heal walk,,Sports
another waterfall conquered amp one kelambulang hills challenging 11km journey took 5 8hrs hiking complete nice features trails slippery rocky amp wet kuching sarawak malaysia covid19 us amp nature simpletoned tourismmalaysia,Sarawak,Sports
sound cicadas loud feels like im japan summer hiking malaysia record bedroom,,Sports
new fine art work noisy asia collection opensea collection made photos took old phone camera first wild hitchhiking journey thailand malaysia cambodia indonesia 2014 nft natalyborichnft nftartists nftphotography nftart,,Sports
uni coursework slovenia country dont speak language never set foot yet easy find required gis data complete project cant even easily get good paper topo maps hiking malaysia,,Sports
throwback first ever experience hiking first ever camera save money cause something interesting coming soon malaysia travel,,Sports
want malaysia normal everyone go jalan jalan go hiking good morning hikers atas bukit go sekarang ni aug last year aug went perhentian snorkeling swimming went perak also first time gi jalan ipoh,Perak,Sports
tbh miss going outdoor activities like going beach hiking go waterfall friends travelat least malaysia pun jadi la many cant believe 20s robbed wasted pandemic,,Sports
vuhlandes personally drank coconut water fresh coconut hiking mountain malaysia refreshing thing ive ever drank know mean,,Sports
ajak dorang pegi hiking belajar martial arts sports cooking stuff technology commin sense pun ofcourse bukan dekat malaysia might live oversea someday either swiss nz cehh berangan nya lol,,Sports
finding vantage point makes best feeling shoot last time went hiking quarantine miss days gopro tourismmalaysia malaysia penang travel hiking mountains goprofamily goproawards gopro hero6 hero,,Sports
good friend whos currently residing canada already gone back normal ways living people already amp businesses booming people free go hiking amp enjoy outdoor sports amp importantly able picnics picturesque lakes malaysia,,Sports
listened last night like bed time stories ears managed hear hiking trips fell asleep naweshadshariff closing line stay safe malaysia woke epicfail malaminisiscubalagi midnightmalaysia,,Sports
like sesatinmalaysia wearing adidas kampung cheapest hiking shoes hike good idea familiar rubber shoes 100 waterproof super practical low maintenance ig sesatinmalaysia bohey dulang island semporna,,Sports
united kids decathlon 13 malaysia wonderful place going camping nature lovers wish embark family adventure taman negara national park place go unitedkidsofdecathlon hiking camping,,Sports
hiking rainforests riding horses five best activities indulge frasers hill malaysia,,Sports
banrionbaby long tome ago friends convinced british teens hiking malaysia turn 16 fight dad win get family boots put mantelpiece lose join priesthood,,Sports
one best hiking trails kk bukit botak near sepangar bay area people types fitness levels would regularly come adrenaline rush also breathtaking view especially sunrise sunset ig sesatinmalaysia,,Sports
bergem great place adventures lived singapore would often cross border malaysia get away hustle bustle hiking trekking canoesport camping,,Sports
als lose use legs longer stand walk still dream walking hiking especially along beautiful mountain trails china indonesia sabah malaysia keeping hope als mnd livingwithals livingwithhope,Sabah,Sports
lot special travel experiences offroad driving anafi greece solo hiking rural hk culinary tour penang malaysia locals ferry sweden finland driving autobahn road trips norway inner mongolia alps frenchitalian border,,Sports
dang bro im tired longday ootd adventure family travelphotography travel challenge love hiking tracking jungle themepark escape bhfyp physical backworkout urban lifestyle nature penang malaysia amazing wanderlust picoftheday kuttangraphy,,Sports
lindenmuthwendi woodfordauthor think 1 threeweek hiking amp birding trip malaysia six years ago,,Sports
hiking iftar arcthurus2 ariekubrie amp sam bukitkuari rawangbypass rawang selangor malaysia ramadhan,Selangor,Sports
always good see either lunch hiking jungles malaysia,,Sports
cases hiking way soon malaysia situation india rn,,Sports
robinson falls cameron highlands malaysia hiking trail runs nearby sizable scenic waterfalls serene lush environment,,Sports
hiking bukit kiara mohdshafieapdal ambigas lovely bumped friends bukit kiara traks malaysia welcome harapans big tent approach unite everyone including civil society step right direction kitaunite,,Sports
hiking national park pulau penang malaysia,,Sports
new day new travel picture somewhere malaysia world book dont travel read page saint august travel photography spring wanderlust trip views vacation hiking malaysia positivevibes quotes adventure,,Sports
new day new travel picture somewhere malaysia world book dont travel read page saint august travel photography spring wanderlust trip views vacation hiking malaysia positivevibes quotes adventure like follome retweeet,,Sports
rtwbarefoot sputniktechno charlesmccool bites hiking malaysia didnt feel anything blood lets know somethings trlt,,Sports
gunung nuang nevespugly via instagram filipkanda via instagram chong5341 via instagram lets go extreme hikes gunung nuang please visit malaysias forestry department website start hiking pusingselangordulu,Selangor,Sports
sometimes think one time malaysia cute biologist tour guide invited go hiking friends say leaving country day,,Sports
davidlstern interested gall formation since grad student hiking jungles malaysia team hhmijanelia idd proteins aphid saliva drive abnormal growths,,Sports
4 reasons hiking great mental health free malaysia today fmt,,Sports
malaysia short getaway 17 unique places next staycation 17 unique places malaysia short getaway get beaten path spots never knew surfing hiking elephants amp overwater bungalows could want,,Sports
climbing gunung raya highest mountain langkawi malaysia alone long way help climbing gunung raya best horror movies mobile signal gunungraya hiking mountain langkawi malaysia,,Sports
little cascade one favorite trip stops perfect natural shower climb sit around good time jungles mowgliventure perak malaysia tourismmalaysia backpackingmalaysia waterfallsofmalaysia hikingmalaysia malaysiahiker,Perak,Sports
want travel like hikingtrekking id like go southeast asia someday malaysia vietnam thailand specifically also im big hiker low iron lmao one time almost passed hiking,,Sports
anothersaltyday hear easy families thats like music ears hahaha malaysia hiking infrastructure isnt developed yet hiking either flat terrain u need use rope climb nothing,,Sports
lets see proactive attempts restart tourism industry mas amp tourismmalaysia charter flights amp travel corridors bleak miserable europe langkawi 14 days golfbeachhikingsunshine bubble easy amp doable march malaysia,,Sports
