text,location,interest
tourdejose three allowed hope haha jakarta johor bahrumalaysia cycling weekend melbourne cycling training partner,Johor,Sports
tlyadeen 1obefiend pity khairykj wasnt cycling past hed fixed jiffymalaysia,,Sports
okay also feel onus safety put cyclists wheres action making sure cars trucks motorbikes go safely quite aggressive around bicycles infra make cycling safer malaysia,,Sports
starting new year ride kutoamafunzo thanks ride boys cycling malaysia 2021 lokl coffee co,,Sports
hope kj goes sarawak sabah cycling trip falls potholes improve roads hidup malaysia,Sabah,Sports
good question bicycle malaysia cycling,,Sports
inviting khairykj cycling tour around malaysia hope help solve pothole issues save lives cyclingchallenge,,Sports
minister got accident hitting potholes jkr loosing shyt well done jkr efficient job hope ministers cycling around malaysia especially sabah sarawak get beautiful scenery,Sabah,Sports
imagine ministers go cycling around malaysia happen,,Sports
support ministers take cycling bad roads malaysia much safer,,Sports
menteri2 amp vvip please start cycling around malaysia need get road fix asap,,Sports
looking bike trainer edwin ng joo ngan son sales bkool smart trainer rm1400 normal price rm2499 throwing two cycling jerseys two bidens one cycling gloves including delivery anywhere malaysia hurry limited 10 units,,Sports
junior cycling malaysia would like wish merry christmas happy new year 2021 cimbjuniorcyclingdp cimbfjcm pathofchampions,,Sports
1st place 3rd place azizulhasni awang mohd shah firdaus sahrom keirin australian national cycling championships superb result given lack competitive racing disrupted season sport vorteqsports aero malaysia,,Sports
two trends happening malaysia one cycling another one bash cyclist social media,,Sports
okay much cyclist believe malaysia isnt ready dont cycling mentality weh kalau geng cyclist sendiri tak ada kapasiti mental road user lain pulak yang tak memahami,,Sports
get know amazing malaysia cycling athletes represented malaysia spotlight cyclescape21 finalyearproject xanthrons0519,,Sports
cycling lane kat malaysia tak consider betulbetul benda macam route taman perumahan ke sekolah ke stesen baslrtktmkemudahan awam kedai pasaraya also daily commute cycling lanes speed limit likely users moving slower,,Sports
cycling kat malaysia ni obviously la nak show lepas ride konfem tunjuk berapa distance avg speed,,Sports
join us later today 200 pm show usap pinoy kauban ni goyo guest efren serrano well talk cycling malaysia philippines well also talk proper bicycle maintenance join us,,Sports
think cycling exercise think follow dave everett cycling tips embarks cycling adventure malaysias cameron highlands malaysiaawaitsyou malaysiatrulyasia tmamericas dreamnowtravellater cycling pahang,Pahang,Sports
love haters theyre biggest fans cyclingmalaysia cyclingkualalumpur gowesrider sji johannian maringestalt1 gravelbike st johns institution,,Sports
cmon leisurerecreationalweekend cyclists please behave reprimand folk giving bad image cycling malaysia,,Sports
shows need malaysia cycling road seronok tengok live alone dia cycle dari rumah dia sampai han river siap cross highway guna cycling road lagi,,Sports
malaysia hot cycling really singapore investing heavily proper cycling network great cycling infrastructure last checked singapore next door neighbour next amsterdam copenhagen,,Sports
transitmy idea cycling t20 hilarious consider people cycle places widely accepted like netherlands spend far less buy bicycles average malaysia 1 month car loan payments petrol,,Sports
cycling whole cycling commuting unsuitable malaysia weather lazy excuse likewise walking unsuitable coz weather colleagues cycled work worked london summer offices showers,,Sports
comes cycling feel like one thing isnt talked enough malaysia seen hobby rather actual mode transportation get point point b,,Sports
aisehman true many roads malaysia bike lanes learn share roads cycling weekend convoy rides also commuting encouraged still rather scary commute bike havent mustered courage,,Sports
rt tourismmalaysia cycling around catch ones breath peaceful hometown kubang semang pulau pinang malaysia yongphotoz cuticutimalaysia malaysiatrulyasia staysafe natgeo instatravel igtravel,Pulau Pinang,Sports
cycling around catch ones breath peaceful hometown kubang semang pulau pinang malaysia yongphotoz cuticutimalaysia malaysiatrulyasia staysafe,Pulau Pinang,Sports
really happy cycling taken big way malaysia 5 years ago remember saying would never become popular weather lack proper cycling facilities happily proven wrong cycling bicycle,,Sports
cycling trending sport malaysia missed drift former pm mahathir mohamad 95 spotted attempting ride bicycle putrajaya,Putrajaya,Sports
team hungary team malaysia cycleball group game uci indoor cycling world championships 2018 liege belgium,,Sports
jekferrs 1 back ipt 2 go hiking malaysia 3 go cycling 4 mandi air terjun puas2 5 get know crushberangan je,,Sports
unbroken 500miles yesdayscotland delivered foot fife support aims lwtf small part 2020 virtual reality triathlon challenge swimming foot cycling combined equates fife malaysia finished saturday totalling 6534 miles,,Sports
praise god safe cooling evening ride kimphotography nikonshots sunset cycling cyclingmalaysia staysafe roadbike roadbike trek emonda trekmalaysia,,Sports
cycling colder months even though monsoon season malaysia isnt easy never knoe going rain wind chilling youve got layer go easy big gears,,Sports
rock n roll ride breezy sunday morning cyclingkualalumpur cyclingmalaysia cuticutikualalumpur cuticutimalaysia malaysianfoldies basikallipat foldingbike javapro5 genggowes kl river life,,Sports
malaysia focus building roads highways instead building friendly pedestrian sites cycling trails like european countries yes im talking city areas,,Sports
shifts urban mobility prompting move towards lowcarbon modes transportation cycling collaboration sedamalaysia global environment facility gef kasamalaysia gtalcc project mitigates lastmile connectivity issues commuters,,Sports
get explore city cyclingmalaysia cyclingkualalumpur malaysianfoldies basikallipat kuala lumpur malaysia,Kuala Lumpur,Sports
quote tweet tweet get 0 likes 0 rts 0 comments 10pm tomorrow pick one winner randomly gets 2020 junior cycling malaysia winners jersey,,Sports
cycling one best ways see experience malaysia meeting people natural landscapes cityscapes different mode transportation malaysiaawaitsyou malaysiatrulyasia tmamericas dreamnowtravellater gone goat,,Sports
many says hot bicycle work malaysia tend agree guy tweeted anyone think cycling work msia toughthink cycling cold winter stiff wind,,Sports
johannian always johannian sji fideetlabore cyclingmalaysia cyclingkualalumpur malaysianfoldies javapro5 genggowes st johns institution,,Sports
rm103 million allocated development upgrade maintenance sports facilities throughout country rm55 million development high potential sports hockey rugby badminton cycling esports belanjawan2021 mypwcbudget,,Sports
began cycling december 2016 making way indonesia malaysia thailand india jordan saudi arabia journey dubbed muslimsforpeace,,Sports
began cycling december 2016 making way indonesia malaysia thailand india jordan saudi arabia wife deciding take journey alone also raise awareness need infant incubators,,Sports
waiting restock malaysia 2 months sold everywhere finally got today better expected ever wan na buy cycling shoes please please please try store wide feet avoid mistake,,Sports
wonderwhy surgeons malaysia like cycling like thing lol,,Sports
sunday activity sunday cycling motoring eat foods sports family love junjong kedah malaysia,Kedah,Sports
saudi cycling group marked malaysias national sports month tour around jeddahs historic albalad district,,Sports
news malaysia app malay mail ismail sabri noncontact sports like cycling jogging athletics training permitted cmco,,Sports
respectively shows cycling amp bikesharing resilient shared public transport time disruptions perhaps time us revolutionize travelling mode malaysia invest cycling amenities amp nurture cycling culture,,Sports
cycling morning exercise sunday weekend shot using canon eos 3000d kkmmgov kkmputrajaya myhealthkkm menarakl visitklofficial bbctravel gayatravel travelokamy travel3sixty cnntravel travelleisure aptravel healthmalaysia bbchealth canon,Putrajaya,Sports
former youth sports minister khairy jamaluddin responsible setting junior cycling malaysia announced return sports,,Sports
side note ive noticed highways put cycling signage makes pretty clear cycling allowed ones signage fine applies 245am im thinking bicycle laws malaysia yeap,,Sports
thrashy sunday keepmalaysiaclean keepthecityclean cyclingmalaysia cyclingkualalumpur malaysianfoldie malaysiaprihatin rudyprihatin kitajagakita,,Sports
also goes show malaysia lacking parks recreational areas tu mungkin salah satu sebab ada org sanggup cycling sampai ke highway,,Sports
badgerbaroudeur brandtenburg94 lukascph pcyclingmanager terengganu part malaysia loves cycling,Terengganu,Sports
joining cycling craze bandwagon tapi level level b40 selamat hari malaysia,,Sports
pedal stay healthy active kdp organized patriotic cycling event conjunction 87th malaysian armed forces day amp 57th national day malaysia,,Sports
curious cycling banned highways malaysia seems like distinction betw smaller amp larger highways ive cycled around putracyberjaya klia motorists generally accommodating,,Sports
rakyat malaysia much potential cycling,,Sports
conjunction malaysia day mpampangjaya organising cycling event kayuhan santai merdeka 12th september led tuan mohd fauzi bin mohd yatim newly appointed yang dipertua mpaj,,Sports
lets ride support local guides kaki ayam tours bike elena tanjak adventure amp tour cuticutimalaysia cuticutikualalumpur cyclingmalaysia cyclingkualalumpur cyclingtourism sapotlokal,,Sports
jonohb carltonkirby robhatchtv seankellycc brismithy sportsorla eurosportuk daniellloyd1 cyclingpodcast locked penang malaysia 2021 despite less infections riders tour loving scenery amp eurosport coverage lifting gloom especially whimsy carlton culinary tips jono,,Sports
know wont happen malaysia lifetime want work cause order kids grandchildren setting green mobility society tram cycling community dreams dream,,Sports
luv rain rpcc cyclingmalaysia cycling,,Sports
big hands come play throwback interviewing amp calebewans personal autograph shirt holder congrats win today caleb throwback ltdl malaysia cycling,,Sports
nstnation cycling proudly love malaysia merdeka jaurgemilang malaysiaprihatin,,Sports
jasminirisha ahmadasyrani benda first time berlaku kat malaysia give sometime indoctrinated caroriented cities movement least bagi awareness one fine day gov improve bicycle infra implememt real policies prioritise cycling cities,,Sports
cycling jersey pilot instruments collection visit website details gt gt bicycle sports sportswear pilotinstrumentscollection pilot aviation aviator aircraft airplane singapore philippines thailand indonesia malaysia,,Sports
2d1n cycling tour melaka via train sg gadut back via tampin exploring road less traveled enjoying scenic route lets travel locally cuticutimalaysia cuticutifoldie malaysiatrulyasia cyclingmalaysia,Melaka,Sports
msuscd would like invite msurians join virtual talk entitled leadership sports mohamad iqbal coach malaysias paralympic cycling team happening 25th august 2020 book slot,,Sports
rivers malaysia protected cordoning tje river reserve embankments nature reserve benefits 1cleaner river waters toxic waste dumping 3nature park community 4promote better quality life venue cyclingamp picnic spot,,Sports
holidays fancy local island resorts cycling latest fad malaysia artistsinstafamous celebrities,,Sports
beacon hope guiding light nice muse singapore teampixel sunsetphotography strava cycling malaysia evening workout strava madebygoogle fossil gen5carlyle rockriderst100,,Sports
today went cycling friends 2pm hot malaysia weather humidity increasing usual days sweat much whole body tired im gon na pass,,Sports
family cycling malaysia great sankey without leaving front room fund raise free heart surgeries developing world thank sarahde42126316 ethandavies healinglittlehearts,,Sports
im watching cloud listening people talking romanian team sapura malaysia happens youve waited 4 months watch cycling,,Sports
ride cycle save pollution jahidkhanvlogs streetphotography fashion cool malaysia malaysiacoronavirus malaysiacovid19 menfashion menphotography cycling cyclinglife savetheplanet beyourself behappy,,Sports
alhamdulillah selesai imagining planning series esharing session no10 design good cycling infrastructure malaysias cities hosted malaysian institute planners mip,,Sports
mirosroadsafety participating webinar design good cycling infrastructure malaysias cities hosted malaysian institute planners mip good luck guys motmalaysia jkrmalaysia,,Sports
great camaraderie one left behind recovery night ride usual suspect cycling cyclinglife wymtm bicycle cyclingshot outsideisfree velo ridebmc zippspeed wahoo putrajaya malaysia,Putrajaya,Sports
hey whats guys proud announce project working sometime project virtual ride cycling enthusiast connect ride banner malaysia national cycling federation mncf,,Sports
garmin malaysia announced two new gps cycling computers edge 1030 plus offering 24 hours battery life,,Sports
garmin malaysia announced two new gps cycling computers edge 1030 plus offering 24 hours battery life,,Sports
ride cycle save pollution jahidkhanvlogs streetphotography fashion cool malaysia malaysiacoronavirus malaysiacovid19 menfashion menphotography cycling cyclinglife savetheplanet beyourself behappy,,Sports
kuala lumpur cycling foodie tour start idr 3750000 wahanatravel malaysia tour cycling foodie tour travel malaysiatourism,Kuala Lumpur,Sports
malaysias sofie louise johansson kelantan shares photo instagram bike accident cycling starbucks causing shoulder fractured ljo sofielouisejohansson kelantan kerabatdiraja,Kelantan,Sports
professional cyclists cycling enthusiasts love garmin introduced malaysia cycling fitness tacx garmin garminmalaysia garmin,,Sports
global scale extensive variation mycorrhizal composition forests complicates predicting carbon amp nutrient cycling esms new paper moniqueweemstra et al important step forward amp uses data lambir malaysia,,Sports
happy results counted 12th 138am morning 30th 1111am still top malaysia say singapore standing classic category meant nothing really cycling time 18mins faster actual road time,,Sports
extra funny malaysia track cycling coach john beasley right also australia taylorreegs,,Sports
amazing see legislators world thinking upon promoting cycling globally glimpses chedetofficial ex pm malaysia cycling 9km around putrajaya lake dr maszlee cycling famous amongst classes cycling malaysia,Putrajaya,Sports
ramainya org cyclingtowards healthier malaysia,,Sports
andrewheiss missionary malaysia 20046 regular proselyting attire colored shirts ties grateful see thing go direction everyone cycling tie doesnt look professional looks silly,,Sports
join us webinar explore experiences cycling indonesia malaysia discuss weather climate factor user experience cycling lessons learned key success factors register link trainveller,,Sports
transitmy huge lines mrt stations today use overpasses dont see pt malaysia stay open social distance unless ridership reduced maybe people need change attitude towards walking cycling,,Sports
malaysia introducing rmco recovery phase lockdown things easing im gon na start committing pokemongoapp grind focused walking cycling work overall fitness tips appreciated id love advice pack prep,,Sports
seronok betul tengok ramai yang aku kenal posting running cycling active together lets hope better healthier malaysia,,Sports
craigbarneybob1 margotljparker drbashirqureshi royalfamily age former prime minister malaysia dr mahathir muhammad chedetofficial wife still riding horse cycling driving like 30s ages inspire royalfamily may allah bless,,Sports
penang mco cycling around city check complete vlog mavicmini gopro malaysia mco cmco covid19 corona,,Sports
sarcasm best wish malaysia lot colder convenient cycling,,Sports
still possible metropolitan areas malaysia develop like cities tokyo beijing enjoyed days walking cycling cities,,Sports
transitmy new normal means packed busses trains uk spending 2bn support walking cycling work help reduce burden pt malaysia still common school run ferrari go shopping bicycle,,Sports
newyoutubers hi latest video malaysia penang cycling streetfood side penang cycling tour review upside museum street food,,Sports
long climb jelebu thanks cyclingmalaysia pic mj look cool hahahahaha,,Sports
new video penang cycling malaysia streetfood youtuber side penang cycling tour review upside museum street food,,Sports
new video penang cycling malaysia streetfood side penang cycling tour review upside museum street food,,Sports
manjung run amp ride 2020 lets run ride manjung run amp ride individual group categories register running cycling malaysia perak,Perak,Sports
cycling expedition north east myanmar thailand malaysia upto malaysia singapore border,,Sports
cycling expedition north east myanmar nationalinstituteofmountaineeringandalliedsports nimas indianarmy cyclingexpedition northeast myanmar thailand malaysia malaysiasingaporeborder,,Sports
new year plans floor india cycling trekking maldivesconference award ceremony philippines cycling manila malaysia nepal thailand vietnam indonesia enlarge dairy need blessings support,,Sports
cycling expedition north east myanmar thailand malaysia upto malaysia singapore border,,Sports
smile placing 9th overall mens masters category iskandarputeri mtb mtbjamboree cycling mountainbiking race mountainbike malaysia donrey,,Sports
ultraman consists 10 km swimming 424 km cycling 84 km running organised delhi international triathlon november 2325 delhi gurgaon october finished ironman malaysia kuntal triathlete ultramarathoner cyclist paratrooper iiitian,,Sports
cycling quite popular topic malaysia health conscious group riding together weekends pesky rempit kids supermans bike dangerously safe say malaysians well apt comes bicycle,,Sports
one biggest cycling brands malaysia stalked ig stories ada nak buat project sama ke please pick,,Sports
aerol cycled around peninsular malaysia singapore southern thailand 51 days clocked 2800km cycling,,Sports
congratulation azizulawang winning keirin event new zealandleg uci track cycling world championships thepocketrocketman keirin cycling newzealand malaysia,,Sports
singapore outride malaysia road cycling,,Sports
noble care malaysia asias no1 nursing home retirement resorts giving cycling exercise old folk muscle relaxation build strength best regards tell 60162786993 601126788650,,Sports
malaysias azizulhasni awang brilliant track record comes performing asiangames asiangamestimeline cycling,,Sports
national cyclists nik mohd azwan bin zulkifle jupha somnet together coach mohd yusof abdul nasir spoke shaz thelitebreakfast morning shared got cycling sport feels like represent malaysia sea games,,Sports
look 2019 sea games skate park bmx cycling track ready action seagames2019philippines skate skateboard bmx ngerumpibola portaldepok indonesia malaysia thailand vietnam singapore,,Sports
sunrise today cycling ipoh perak malaysia two,Perak,Sports
ucicycling keep riding work everyday true malaysia monsoons winter still,,Sports
chedetofficial ltdl two additional races would strengthen malaysias position one cycling powerhouses southeast asia pm mahathir chedetofficial,,Sports
really love variety cuisine indian breakfast malay second breakfast delicious fish chicken lunch enteral hunger persists road singapore cycling cycletouring malaysia,,Sports
cycling hemodialysis recently introduced one local hospitals malaysias capital city kotakinabalu read new dialysis kinesiology program impact patients dailyexpressmys article,,Sports
thanks cycling plus malaysia,,Sports
jb cycling tragedy prosecution files appeal drivers acquittal malaysia rodahidup 1einxnitta ahkmlog billtay25 devilishram drsunflower extttc geanalyst imfseaaruna lowelsielow marysoh nonvitaltooth yvonneapy zulnine09,,Sports
best electrolyte drink cycling cycletouring malaysia withrefugees stepwithrefugees refugees surlybikesuk surlysociety alor janggus kedah malaysia,Kedah,Sports
john cycling support parkinsonsuk challenge cycle thailand malaysia singapore parkinsonsuk cycleforparkinsonsuk goneactive,,Sports
tweetshyd venkatmaddula4 rajaniweather yes long distances decent amountbut short distance like jntu cyber towersmalaysia township charge 65thats minimum amountin uk proper footpathsseparate lanes cyclingneed concentrate providing better infra,,Sports
years back remember involving discussion downhill sports gravity sports like downhill boxcar downhill cycling downhill skateboarding street luge downhill skateboarding communities malaysia read jes muhammad izaidin,,Sports
four cyclists utbs cycling team managed top 10 fastest racer latest reiteration varsity cycling challenge vcc held recently universiti teknologi malaysia melaka utem thebruneiannews,Melaka,Sports
encourage use buses say bus scene malaysia well developed cycling final mile solution get close distances public transport stationhub could massively lower cost living manifold,,Sports
malaysia hot cant cycling work everyday,,Sports
romanian champ serghei tvetcov ride next season team sapura malaysia still think deserved shot big league thats cyclingafter north america time rock asia good luck tsvetkov13,,Sports
lt col swaroop singh kuntal completes ironman malaysia 12 hrs 14 minutes event held langkawi island malaysia consist 38 kms sea swimming followed 180 kms cycling finally 422 kms running 17 hrs congratulations adgpi jaihind,,Sports
lt col swaroop singh kuntal completes ironman malaysia 12 hrs 14 minutes event held langkawi island malaysia consist 38 kms sea swimming followed 180 kms cycling finally 422 kms running 17 hrs,,Sports
lt col swaroop singh kuntal completes ironman malaysia 12 hrs 14 minutes event held langkawi island malaysia consist 38 kms sea swimming followed 180 kms cycling finally 422 kms running 17 hrs adventure achievement,,Sports
welcome bangkok theo today theoworldcycle met unhcrthailand representative deputy representative learn refugees activities thailand theo cycling around world support 2billionkms campaign safe onward travels malaysia,,Sports
malaysias storytelling cycling hero azizulhasni regales fans tales crazy tall thor refusing beaten,,Sports
john malaysia sunday john cycling country parkinsonsuk parkinsons parkinsonsuk deepbrainstimulation,,Sports
someone came airport asked cycling route im malaysia said ok langkawi always challenging every year said tough cyclist like well thing dont think raced,,Sports
celebrity cycling x gangwon korea finally done 170km gangwon korea thanks gangwongogo ktomalaysia mas thulemy gangwon olympiclegacy cyclingingangwon ktomalaysia,,Sports
celebrity cycling x gangwon korea finally done 170km gangwon korea thanks gangwongogo ktomalaysia mas thulemy gangwon olympiclegacy cyclingingangwon ktomalaysia,,Sports
belanja teaser sikit celebrity cycling x gangwon korea collaboration gangwon province korea tourism organisation malaysia airlines video jakeltextile gangwon olympiclegacy,,Sports
celebrity cycling x gangwon korea gangwon olympiclegacy cyclingingangwon ktomalaysia imagineyourkorea malaysiaairlines malaysianhospitality gangwongogo ktomalaysia mas high 1 resort,,Sports
newbie celebrity cycling x gangwon korea gangwon olympiclegacy cyclingingangwon ktomalaysia imagineyourkorea malaysiaairlines malaysianhospitality gangwongogo ktomalaysia mas,,Sports
day2 leisure celebrity cycling x gangwon korea collaboration gangwon province korea tourism organisation malaysia airlines gangwon olympiclegacy cyclingingangwon ktomalaysia,,Sports
300km go stars need spirit bismillah celebrity cycling x gangwon korea collaboration gangwon tourism organisation korea tourism organisation malaysia airlines gangwon,,Sports
klausbondam kindly giving precious time come tell us cycling cycling culture dk citiesforpeople gehl mariniurbanismo health wellbeing malaysia gehl architects,,Sports
let decide celebrity cycling x gangwon korea gangwon olympiclegacy cyclingingangwon ktomalaysia imagineyourkorea malaysiaairlines malaysianhospitality gangwongogo ktomalaysia mas thule,,Sports
klausbondam lindy giving precious time come tell us cycling cycling culture dk citiesforpeople gehl mariniurbanismo health wellbeing malaysia gehl architects,,Sports
day1 celebrity cycling x gangwon korea collaboration gangwon tourism organisation korea tourism organisation malaysia airlines gangwon olympiclegacy cyclingingangwon ktomalaysia,,Sports
cycling asian cycle track championships 2019 congratulations azizul awang malaysia winning silver medal mens keirin ctto,,Sports
tourpeninsular1 stage 3 enjoy awesome emotional speech local commentator feel happy malaysian guys f mazuki harrifsaleh tsgcyclingteam managed incredible moment congrats cyclingmalaysia cycling,,Sports
captured photos riders olivers real food racing kinan cycling team 7eleven cliqq air21 brunei continental cycling team protouch hurom bdc development amp course malaysia national team tourofpeninsular2019 stormtheweather,,Sports
great blue bicycle lanes everywhere lot needs done awareness raising driving regulations cycling becomes part everyday life trafficrulesaremeanttobebroken malaysia whatlawandorder sustainabletransport,,Sports
love mayors across asia pacific shared dedicated bicycle lane penang malaysia open apuf7 today shows regional commitment creation cycling cities benefiting residents,,Sports
